{
  "type": "apparule.payments.outcome",
  "version": "1.0",
  "id": "00000000-0000-4000-8000-000000013557",
  "request_id": "9e8d7c6b-5a49-4382-9716-05f4e3d2c1b0",
  "produced_at": "2026-10-19T10:00:00Z",
  "data": {
    "outcome_id": "5e6f7081-92a3-4b4c-8d5e-6f708192a3b4",
    "kind": "charge_settled",
    "request_id": "7a8b9c0d-1e2f-4a3b-8c4d-5e6f7a8b9c0d",
    "provider_event_id": "9e8d7c6b-5a49-4382-9716-05f4e3d2c1b0",
    "reference": "apr_7a8b9c0d1e2f4a3b8c4d5e6f7a8b9c0d",
    "provider_ref": "4099260516",
    "amount": {
      "amount": 4500000,
      "currency": "NGN"
    },
    "ledger": [
      {
        "account": "escrow",
        "amount": 4500000
      },
      {
        "account": "customer_funds",
        "amount": -4500000
      }
    ]
  }
}