{
  "type": "apparule.payments.outcome",
  "version": "1.0",
  "id": "00000000-0000-4000-8000-000000017335",
  "request_id": "5a6b7c8d-9e0f-4a1b-8c2d-3e4f5a6b7c8d",
  "produced_at": "2026-10-19T10:00:00Z",
  "data": {
    "outcome_id": "6f708192-a3b4-4c5d-8e6f-708192a3b4c5",
    "kind": "recipient_verified",
    "designer_id": "2b3c4d5e-6f70-4a81-9b2c-3d4e5f6a7b8c",
    "attempt_id": "6b7c8d9e-0f1a-4b2c-9d3e-4f5a6b7c8d9e",
    "recipient": {
      "recipient_code": "RCP_t0ya41mp35flk40",
      "account_name": "ADAEZE OKAFOR",
      "bank_name": "Guaranty Trust Bank",
      "last4": "6789"
    }
  }
}