{
  "type": "apparule.capture.measured",
  "version": "1.0",
  "id": "00000000-0000-4000-8000-000000007bbd",
  "request_id": "5c2a9d1e-3b4f-4a6c-8d7e-9f0a1b2c3d4e:1",
  "produced_at": "2026-10-19T10:00:00Z",
  "data": {
    "session_id": "5c2a9d1e-3b4f-4a6c-8d7e-9f0a1b2c3d4e",
    "attempt": 1,
    "status": "measured",
    "method": "mediapipe_2d_v2",
    "thresholds_version": "qc-2026-10-19",
    "poses": {
      "front": "accepted",
      "side": "accepted"
    },
    "measurements": [
      {
        "name": "shoulder",
        "value_cm": 39.4,
        "confidence": 0.86
      },
      {
        "name": "bust",
        "value_cm": 91.2,
        "confidence": 0.74
      },
      {
        "name": "waist",
        "value_cm": 74.8,
        "confidence": 0.71
      }
    ],
    "meta": {
      "height_suspect": false,
      "pose_model": "pose_landmarker",
      "segmentation_model": "selfie_segmenter",
      "ms": 2140
    }
  }
}